{
    "model": "chat-meta-llama-3.1-8b-instruct",
    "max_tokens": 512,
    "min_tokens": 1,
    "presence_penalty": 0,
    "frequency_penalty": 0,
    "repetition_penalty": 1,
    "length_penalty": 1,
    "temperature": 0.7,
    "top_p": 0.7,
    "top_k": 50,
    "min_p": 0,
    "ignore_eos": false,
    "system_prompt": "A chat between a curious user and an artificial intelligence assistant. The assistant gives helpful, detailed, and polite answers to the user's questions.",
    "seed": 1234
}